post_id,title,post_description,post_tags,post_publishing_date,post_inferred_tags
1,"E-commerce Website Development","We are looking for a skilled web developer to create an interactive and user-friendly e-commerce website for our online store. The website should have an appealing design, smooth navigation, and secure payment gateways. It should also support inventory management and order tracking. We require a responsive and mobile-friendly platform that can handle a large number of products and customers. The chosen developer will need to integrate various third-party plugins, implement SEO best practices, and ensure the site's optimal performance. If you have prior experience in developing e-commerce websites and possess a strong understanding of web security, we'd like to hear from you.","web development, e-commerce, responsitivity, SEO",2022-03-02
2,"Market Research for a New Product Launch","We require a meticulous market researcher to conduct a thorough analysis of the market landscape for our upcoming product launch. The research should include an assessment of competitors, target audience preferences, pricing strategies, and potential distribution channels. The ideal candidate should have experience in both quantitative and qualitative research methods, be proficient in data analysis, and provide actionable insights to guide our product strategy.","market research, data analysis, strategic thinking",2021-04-19
3,"Social Media Marketing Campaign","We are seeking a creative and results-driven social media marketer to plan and execute a marketing campaign across various platforms. The goal is to increase brand awareness, engage with the audience, and drive website traffic. The ideal candidate should have a strong understanding of social media algorithms, content creation, and analytics. Experience in managing successful social media campaigns for businesses in the same industry is a plus. The selected marketer will be responsible for monitoring performance, making data-driven decisions, and providing regular progress reports.","marketing, social media, reporting, content creation",2021-05-19
4,"Content Marketing for a Software Company","We are in need of a talented content marketer to create compelling and informative content for our software company's blog and website. The content should be SEO optimized and cater to both our target audience and industry trends. The chosen marketer will be responsible for conducting keyword research, writing blog posts, creating engaging website copy, and developing email marketing campaigns. Knowledge of the software industry and experience in B2B content marketing will be highly advantageous.","content marketer, marketing, B2B, marketing campaigns, SEO",2020-09-13
5,"Scientific Research Paper Review","We are seeking a skilled researcher familiar with scientific literature to review and analyze a research paper in the field of environmental science. The reviewer should critically assess the paper's methodology, data analysis, and conclusions. Additionally, they will need to compare it with other relevant studies to provide a well-rounded evaluation. Proficiency in scientific writing and knowledge of environmental science is essential.","research, scientific literature, environmental science, analysis",2020-06-20
6,"Creative Content Writing for a Travel Website","We are looking for a creative and talented content writer to produce engaging and SEO-friendly articles for our travel website. The articles should cover various travel destinations, tips, and experiences. The ideal candidate should have a passion for travel, exceptional writing skills, and the ability to optimize content for search engines. Prior experience in travel writing and a strong portfolio will be advantageous.","content writing, travel, SEO",2022-03-25
